{
 "schema": "xaudaily.readings/v1",
 "generated_at": "2026-10-20 22:42 JST",
 "data_asof": "2026-10-20 22:40",
 "units": {
  "gold": "USD/oz（COMEX GC 连续；live 为其后的实时 tick）",
  "au": "CNY/g（上期所/SGE Au99.99 连续）",
  "cpi": "% 同比",
  "pce": "% 同比（月度，BEA PCEPILFE 经 FRED；某源失败时沿用旧值，此时看 freq 字段）",
  "pceQ": "% 同比（季度对照，BEA NIPA 2.3.4）",
  "ppi": "% 同比",
  "nfp": "万人（新增非农）",
  "dxy": "指数",
  "gdp": "% 年化环比",
  "treasury": "%（美债 10Y/30Y 收益率）",
  "oil": "USD/桶（Brent/WTI）",
  "extra.vix": "指数",
  "extra.spdr": "吨（SPDR 黄金 ETF 持仓）",
  "extra.fedRate.value": "%（联邦基金利率目标上限）",
  "extra.polymarket": "0~1 的隐含概率（Polymarket 下一次未结算决议的定价）",
  "extra.debt.debtPctGdp": "%（联邦债务/GDP，季度）",
  "extra.debt.netInterest": "十亿美元（年化，FRED 原序列值；季度见 netInterestQ）",
  "extra.cbFlow": "吨（IMF 报告国口径的央行净购金）"
 },
 "site": {
  "home": "https://xaudaily.com/",
  "daily_archive": "https://xaudaily.com/d/2026-10-20.html",
  "archive_index": "https://xaudaily.com/d/",
  "brief_md": "https://xaudaily.com/brief.md",
  "llms_txt": "https://xaudaily.com/llms.txt",
  "topics": "https://xaudaily.com/topic/",
  "sitemap": "https://xaudaily.com/sitemap.xml"
 },
 "readings": {
  "gold": {
   "label": "COMEX GC 连续",
   "unit": "美元/盎司",
   "source": "AKShare·新浪全球期货外盘（复用 GodInformation 采集链路）",
   "asOf": "2026-10-20",
   "rows": [
    {
     "d": "2026-05-06",
     "o": 4567.5,
     "h": 4734.6,
     "l": 4556.1,
     "c": 4702.2
    },
    {
     "d": "2026-05-07",
     "o": 4702.2,
     "h": 4775.2,
     "l": 4693.3,
     "c": 4694.9
    },
    {
     "d": "2026-05-08",
     "o": 4694.9,
     "h": 4760.4,
     "l": 4671.0,
     "c": 4723.3
    },
    {
     "d": "2026-05-11",
     "o": 4723.3,
     "h": 4758.4,
     "l": 4655.1,
     "c": 4745.5
    },
    {
     "d": "2026-05-12",
     "o": 4745.3,
     "h": 4783.4,
     "l": 4645.2,
     "c": 4722.3
    },
    {
     "d": "2026-05-13",
     "o": 4722.3,
     "h": 4734.8,
     "l": 4676.0,
     "c": 4696.3
    },
    {
     "d": "2026-05-14",
     "o": 4696.3,
     "h": 4725.8,
     "l": 4649.3,
     "c": 4655.3
    },
    {
     "d": "2026-05-15",
     "o": 4655.3,
     "h": 4670.1,
     "l": 4513.8,
     "c": 4543.3
    },
    {
     "d": "2026-05-18",
     "o": 4543.3,
     "h": 4588.6,
     "l": 4483.5,
     "c": 4570.6
    },
    {
     "d": "2026-05-19",
     "o": 4570.6,
     "h": 4593.2,
     "l": 4467.1,
     "c": 4485.3
    },
    {
     "d": "2026-05-20",
     "o": 4485.3,
     "h": 4558.4,
     "l": 4455.0,
     "c": 4546.2
    },
    {
     "d": "2026-05-21",
     "o": 4546.2,
     "h": 4572.4,
     "l": 4488.3,
     "c": 4543.8
    },
    {
     "d": "2026-05-22",
     "o": 4543.8,
     "h": 4581.0,
     "l": 4521.8,
     "c": 4543.3
    },
    {
     "d": "2026-05-25",
     "o": 4543.3,
     "h": 4615.4,
     "l": 4565.1,
     "c": 4604.8
    },
    {
     "d": "2026-05-26",
     "o": 4566.0,
     "h": 4615.6,
     "l": 4512.8,
     "c": 4541.3
    },
    {
     "d": "2026-05-27",
     "o": 4540.5,
     "h": 4561.2,
     "l": 4431.0,
     "c": 4488.2
    },
    {
     "d": "2026-05-28",
     "o": 4488.2,
     "h": 4547.1,
     "l": 4395.6,
     "c": 4527.0
    },
    {
     "d": "2026-05-29",
     "o": 4527.0,
     "h": 4627.1,
     "l": 4519.5,
     "c": 4569.4
    },
    {
     "d": "2026-06-01",
     "o": 4569.4,
     "h": 4577.3,
     "l": 4476.0,
     "c": 4514.8
    },
    {
     "d": "2026-06-02",
     "o": 4514.8,
     "h": 4571.3,
     "l": 4492.3,
     "c": 4519.2
    },
    {
     "d": "2026-06-03",
     "o": 4519.2,
     "h": 4525.1,
     "l": 4454.0,
     "c": 4462.7
    },
    {
     "d": "2026-06-04",
     "o": 4462.7,
     "h": 4543.2,
     "l": 4450.1,
     "c": 4502.4
    },
    {
     "d": "2026-06-05",
     "o": 4502.4,
     "h": 4508.7,
     "l": 4336.6,
     "c": 4353.8
    },
    {
     "d": "2026-06-08",
     "o": 4353.8,
     "h": 4377.5,
     "l": 4293.0,
     "c": 4353.7
    },
    {
     "d": "2026-06-09",
     "o": 4353.7,
     "h": 4388.6,
     "l": 4259.9,
     "c": 4284.7
    },
    {
     "d": "2026-06-10",
     "o": 4284.7,
     "h": 4281.1,
     "l": 4090.1,
     "c": 4094.1
    },
    {
     "d": "2026-06-11",
     "o": 4094.1,
     "h": 4241.3,
     "l": 4046.2,
     "c": 4233.5
    },
    {
     "d": "2026-06-12",
     "o": 4233.5,
     "h": 4267.8,
     "l": 4191.1,
     "c": 4239.9
    },
    {
     "d": "2026-06-15",
     "o": 4239.9,
     "h": 4391.5,
     "l": 4283.4,
     "c": 4330.6
    },
    {
     "d": "2026-06-16",
     "o": 4331.3,
     "h": 4376.5,
     "l": 4326.7,
     "c": 4352.8
    },
    {
     "d": "2026-06-17",
     "o": 4352.6,
     "h": 4403.6,
     "l": 4237.4,
     "c": 4275.9
    },
    {
     "d": "2026-06-18",
     "o": 4275.9,
     "h": 4350.2,
     "l": 4220.3,
     "c": 4227.9
    },
    {
     "d": "2026-06-19",
     "o": 4227.9,
     "h": 4231.4,
     "l": 4138.7,
     "c": 4172.2
    },
    {
     "d": "2026-06-22",
     "o": 4172.2,
     "h": 4238.1,
     "l": 4138.7,
     "c": 4209.7
    },
    {
     "d": "2026-06-23",
     "o": 4210.8,
     "h": 4216.0,
     "l": 4108.2,
     "c": 4128.5
    },
    {
     "d": "2026-06-24",
     "o": 4130.0,
     "h": 4132.4,
     "l": 3975.7,
     "c": 4016.3
    },
    {
     "d": "2026-06-25",
     "o": 4016.3,
     "h": 4060.0,
     "l": 3976.3,
     "c": 4041.5
    },
    {
     "d": "2026-06-26",
     "o": 4041.5,
     "h": 4111.5,
     "l": 3998.1,
     "c": 4102.4
    },
    {
     "d": "2026-06-29",
     "o": 4102.4,
     "h": 4102.9,
     "l": 4012.0,
     "c": 4030.4
    },
    {
     "d": "2026-06-30",
     "o": 4030.4,
     "h": 4078.1,
     "l": 3955.4,
     "c": 4021.2
    },
    {
     "d": "2026-07-01",
     "o": 4021.2,
     "h": 4131.0,
     "l": 3973.0,
     "c": 4044.1
    },
    {
     "d": "2026-07-02",
     "o": 4044.1,
     "h": 4157.1,
     "l": 4042.8,
     "c": 4135.5
    },
    {
     "d": "2026-07-03",
     "o": 4135.5,
     "h": 4208.3,
     "l": 4133.8,
     "c": 4186.8
    },
    {
     "d": "2026-07-06",
     "o": 4186.8,
     "h": 4215.5,
     "l": 4133.8,
     "c": 4176.1
    },
    {
     "d": "2026-07-07",
     "o": 4176.4,
     "h": 4192.4,
     "l": 4102.7,
     "c": 4116.6
    },
    {
     "d": "2026-07-08",
     "o": 4116.6,
     "h": 4144.7,
     "l": 4032.5,
     "c": 4085.6
    },
    {
     "d": "2026-07-09",
     "o": 4087.6,
     "h": 4148.4,
     "l": 4063.4,
     "c": 4132.4
    },
    {
     "d": "2026-07-10",
     "o": 4135.4,
     "h": 4144.6,
     "l": 4081.7,
     "c": 4128.4
    },
    {
     "d": "2026-07-13",
     "o": 4128.4,
     "h": 4111.6,
     "l": 3992.9,
     "c": 4008.3
    },
    {
     "d": "2026-07-14",
     "o": 4008.3,
     "h": 4112.5,
     "l": 3990.4,
     "c": 4057.9
    },
    {
     "d": "2026-07-15",
     "o": 4059.8,
     "h": 4089.1,
     "l": 4023.3,
     "c": 4066.7
    },
    {
     "d": "2026-07-16",
     "o": 4068.9,
     "h": 4071.9,
     "l": 3973.4,
     "c": 3979.8
    },
    {
     "d": "2026-07-17",
     "o": 3979.8,
     "h": 4028.9,
     "l": 3963.0,
     "c": 4022.7
    },
    {
     "d": "2026-07-20",
     "o": 4022.7,
     "h": 4046.0,
     "l": 3986.5,
     "c": 4011.8
    },
    {
     "d": "2026-07-21",
     "o": 4011.8,
     "h": 4092.5,
     "l": 4003.3,
     "c": 4081.6
    },
    {
     "d": "2026-07-22",
     "o": 4084.7,
     "h": 4171.4,
     "l": 4081.0,
     "c": 4134.7
    },
    {
     "d": "2026-07-23",
     "o": 4134.7,
     "h": 4144.0,
     "l": 4042.5,
     "c": 4052.1
    },
    {
     "d": "2026-07-24",
     "o": 4052.1,
     "h": 4085.2,
     "l": 4024.0,
     "c": 4055.2
    },
    {
     "d": "2026-07-27",
     "o": 4055.2,
     "h": 4178.5,
     "l": 4126.5,
     "c": 4138.0
    },
    {
     "d": "2026-07-28",
     "o": 4138.0,
     "h": 4145.0,
     "l": 4071.0,
     "c": 4088.2
    },
    {
     "d": "2026-07-29",
     "o": 4088.2,
     "h": 4176.8,
     "l": 4053.9,
     "c": 4125.9
    },
    {
     "d": "2026-07-30",
     "o": 4125.9,
     "h": 4180.2,
     "l": 4085.0,
     "c": 4162.3
    },
    {
     "d": "2026-07-31",
     "o": 4163.9,
     "h": 4170.7,
     "l": 4076.4,
     "c": 4097.6
    },
    {
     "d": "2026-08-03",
     "o": 4097.6,
     "h": 4145.5,
     "l": 4074.0,
     "c": 4110.9
    },
    {
     "d": "2026-08-04",
     "o": 4110.9,
     "h": 4163.8,
     "l": 4098.2,
     "c": 4134.1
    },
    {
     "d": "2026-08-05",
     "o": 4133.8,
     "h": 4328.2,
     "l": 4121.6,
     "c": 4307.7
    },
    {
     "d": "2026-08-06",
     "o": 4307.7,
     "h": 4363.7,
     "l": 4281.2,
     "c": 4298.4
    },
    {
     "d": "2026-08-07",
     "o": 4298.3,
     "h": 4432.3,
     "l": 4288.0,
     "c": 4400.8
    },
    {
     "d": "2026-08-10",
     "o": 4400.8,
     "h": 4453.8,
     "l": 4373.9,
     "c": 4448.5
    },
    {
     "d": "2026-08-11",
     "o": 4448.5,
     "h": 4495.0,
     "l": 4415.7,
     "c": 4427.7
    },
    {
     "d": "2026-08-12",
     "o": 4427.7,
     "h": 4502.7,
     "l": 4421.4,
     "c": 4468.6
    },
    {
     "d": "2026-08-13",
     "o": 4468.6,
     "h": 4509.1,
     "l": 4400.0,
     "c": 4406.7
    },
    {
     "d": "2026-08-14",
     "o": 4406.7,
     "h": 4454.6,
     "l": 4365.5,
     "c": 4431.9
    },
    {
     "d": "2026-08-17",
     "o": 4431.9,
     "h": 4486.5,
     "l": 4422.3,
     "c": 4473.1
    },
    {
     "d": "2026-08-18",
     "o": 4473.1,
     "h": 4493.1,
     "l": 4383.3,
     "c": 4389.4
    },
    {
     "d": "2026-08-19",
     "o": 4389.4,
     "h": 4582.8,
     "l": 4378.0,
     "c": 4580.7
    },
    {
     "d": "2026-08-20",
     "o": 4580.7,
     "h": 4597.1,
     "l": 4506.0,
     "c": 4574.8
    },
    {
     "d": "2026-08-21",
     "o": 4574.8,
     "h": 4690.4,
     "l": 4565.5,
     "c": 4661.6
    },
    {
     "d": "2026-08-24",
     "o": 4661.6,
     "h": 4738.5,
     "l": 4651.8,
     "c": 4709.7
    },
    {
     "d": "2026-08-25",
     "o": 4709.7,
     "h": 4755.0,
     "l": 4659.5,
     "c": 4715.7
    },
    {
     "d": "2026-08-26",
     "o": 4715.7,
     "h": 4730.9,